{
  "audit_id": "goal-dfe-post-execution-20260730",
  "authority_effect": "none",
  "mutation_mode": "proposal-only",
  "mutation_ready": false,
  "next_owner": "invoke:refresh",
  "schema_version": "1.0.0",
  "signals": [
    {
      "claim": "captured work pack requires no refresh repair",
      "confidence": "high",
      "evidence": [
        "audit verdict=pass"
      ],
      "id": "goal-dfe-post-execution-20260730:no-op",
      "mutation_safety": "safe",
      "signal_type": "no_op",
      "target_artifacts": [
        "work-pack-readiness-report.json"
      ]
    }
  ],
  "source_report": {
    "path": "work-pack-readiness-report.json",
    "sha256": "1af29dd14e6229ca0d7c417a5fb1ba4817f4e3fc85e5e45f867a62ee735f1dbb",
    "size_bytes": 1914
  },
  "target_inventory": [
    "work-pack-readiness-report.json"
  ]
}
