{
  "audit_id": "goal-dfe-pre-execution-20260730",
  "authority_effect": "none",
  "mutation_mode": "proposal-only",
  "mutation_ready": false,
  "next_owner": "invoke:refresh",
  "schema_version": "1.0.0",
  "signals": [
    {
      "claim": "validation cwd is missing or escapes the repository",
      "confidence": "high",
      "evidence": [
        "invalid relative path: ."
      ],
      "id": "goal-dfe-pre-execution-20260730:WPA-001",
      "mutation_safety": "needs_review",
      "signal_type": "blocker_opened",
      "target_artifacts": [
        "spells/goal/development/invoke-runs/20260730T171428Z-decision-frontier-experiment/work-pack/tasks/TASK-DFE-CONTRACT.md"
      ]
    },
    {
      "claim": "validation cwd is missing or escapes the repository",
      "confidence": "high",
      "evidence": [
        "invalid relative path: ."
      ],
      "id": "goal-dfe-pre-execution-20260730:WPA-002",
      "mutation_safety": "needs_review",
      "signal_type": "blocker_opened",
      "target_artifacts": [
        "spells/goal/development/invoke-runs/20260730T171428Z-decision-frontier-experiment/work-pack/tasks/TASK-DFE-REDUCER.md"
      ]
    },
    {
      "claim": "validation cwd is missing or escapes the repository",
      "confidence": "high",
      "evidence": [
        "invalid relative path: ."
      ],
      "id": "goal-dfe-pre-execution-20260730:WPA-003",
      "mutation_safety": "needs_review",
      "signal_type": "blocker_opened",
      "target_artifacts": [
        "spells/goal/development/invoke-runs/20260730T171428Z-decision-frontier-experiment/work-pack/tasks/TASK-DFE-CLAIM.md"
      ]
    },
    {
      "claim": "validation cwd is missing or escapes the repository",
      "confidence": "high",
      "evidence": [
        "invalid relative path: ."
      ],
      "id": "goal-dfe-pre-execution-20260730:WPA-004",
      "mutation_safety": "needs_review",
      "signal_type": "blocker_opened",
      "target_artifacts": [
        "spells/goal/development/invoke-runs/20260730T171428Z-decision-frontier-experiment/work-pack/tasks/TASK-DFE-RECONCILE.md"
      ]
    },
    {
      "claim": "validation cwd is missing or escapes the repository",
      "confidence": "high",
      "evidence": [
        "invalid relative path: ."
      ],
      "id": "goal-dfe-pre-execution-20260730:WPA-005",
      "mutation_safety": "needs_review",
      "signal_type": "blocker_opened",
      "target_artifacts": [
        "spells/goal/development/invoke-runs/20260730T171428Z-decision-frontier-experiment/work-pack/tasks/TASK-DFE-BOUNDARY.md"
      ]
    },
    {
      "claim": "validation cwd is missing or escapes the repository",
      "confidence": "high",
      "evidence": [
        "invalid relative path: ."
      ],
      "id": "goal-dfe-pre-execution-20260730:WPA-006",
      "mutation_safety": "needs_review",
      "signal_type": "blocker_opened",
      "target_artifacts": [
        "spells/goal/development/invoke-runs/20260730T171428Z-decision-frontier-experiment/work-pack/tasks/TASK-DFE-BOUNDARY.md"
      ]
    },
    {
      "claim": "validation cwd is missing or escapes the repository",
      "confidence": "high",
      "evidence": [
        "invalid relative path: ."
      ],
      "id": "goal-dfe-pre-execution-20260730:WPA-007",
      "mutation_safety": "needs_review",
      "signal_type": "blocker_opened",
      "target_artifacts": [
        "spells/goal/development/invoke-runs/20260730T171428Z-decision-frontier-experiment/work-pack/tasks/TASK-DFE-BOUNDARY.md"
      ]
    },
    {
      "claim": "validation cwd is missing or escapes the repository",
      "confidence": "high",
      "evidence": [
        "invalid relative path: ."
      ],
      "id": "goal-dfe-pre-execution-20260730:WPA-008",
      "mutation_safety": "needs_review",
      "signal_type": "blocker_opened",
      "target_artifacts": [
        "spells/goal/development/invoke-runs/20260730T171428Z-decision-frontier-experiment/work-pack/tasks/TASK-DFE-VERIFY.md"
      ]
    },
    {
      "claim": "validation cwd is missing or escapes the repository",
      "confidence": "high",
      "evidence": [
        "invalid relative path: ."
      ],
      "id": "goal-dfe-pre-execution-20260730:WPA-009",
      "mutation_safety": "needs_review",
      "signal_type": "blocker_opened",
      "target_artifacts": [
        "spells/goal/development/invoke-runs/20260730T171428Z-decision-frontier-experiment/work-pack/tasks/TASK-DFE-READINESS.md"
      ]
    }
  ],
  "source_report": {
    "path": "work-pack-readiness-report.json",
    "sha256": "4f79b11fdf64a748a9b842eacee6ea2b8c96c57a9aae9e445281b0a643bb6bf5",
    "size_bytes": 6632
  },
  "target_inventory": [
    "spells/goal/development/invoke-runs/20260730T171428Z-decision-frontier-experiment/work-pack/tasks/TASK-DFE-BOUNDARY.md",
    "spells/goal/development/invoke-runs/20260730T171428Z-decision-frontier-experiment/work-pack/tasks/TASK-DFE-CLAIM.md",
    "spells/goal/development/invoke-runs/20260730T171428Z-decision-frontier-experiment/work-pack/tasks/TASK-DFE-CONTRACT.md",
    "spells/goal/development/invoke-runs/20260730T171428Z-decision-frontier-experiment/work-pack/tasks/TASK-DFE-READINESS.md",
    "spells/goal/development/invoke-runs/20260730T171428Z-decision-frontier-experiment/work-pack/tasks/TASK-DFE-RECONCILE.md",
    "spells/goal/development/invoke-runs/20260730T171428Z-decision-frontier-experiment/work-pack/tasks/TASK-DFE-REDUCER.md",
    "spells/goal/development/invoke-runs/20260730T171428Z-decision-frontier-experiment/work-pack/tasks/TASK-DFE-VERIFY.md"
  ]
}
